{"$schema":"https://json-schema.org/draft/2020-12/schema","$id":"motion.schema.json","title":"YVL motion","type":"object","required":["$schema","version","duration","easing","reducedMotion"],"additionalProperties":false,"properties":{"$schema":{"const":"../schemas/motion.schema.json"},"version":{"const":"1.0.0"},"duration":{"type":"object","required":["instant","fast","normal","slow"],"maxProperties":4,"additionalProperties":{"type":"string","pattern":"^[0-9]+ms$"}},"easing":{"type":"object","required":["standard","enter","exit"],"maxProperties":3,"additionalProperties":{"type":"string","pattern":"^cubic-bezier\\([^)]*\\)$"}},"reducedMotion":{"type":"string","minLength":1}}}
