{"$schema":"../schemas/motion.schema.json","version":"1.0.0","duration":{"instant":"0ms","fast":"120ms","normal":"200ms","slow":"320ms"},"easing":{"standard":"cubic-bezier(0.2, 0, 0, 1)","enter":"cubic-bezier(0, 0, 0.2, 1)","exit":"cubic-bezier(0.4, 0, 1, 1)"},"reducedMotion":"Remove non-essential movement and use instant state changes."}
